batch,product,url,laag,ernst/oordeel,bevinding/claim,toelichting,bron
2,Autel MaxiSys Ultra | Update-licentie,https://astools.nl/products/autel-maxisys-ultra-update-licentie,extern,klopt,Update-licentie MaxiSys Ultra heeft looptijd van een jaar,Autel bevestigt het Total Care Program als 12-maands abonnement; de Ultra-lijn expliciet genoemd.,https://autel.us/software-subscriptions/
2,Autel MaxiSys Ultra | Update-licentie,https://astools.nl/products/autel-maxisys-ultra-update-licentie,extern,klopt,Na verloop blijft het toestel functioneren op de laatste versie; online functies en updates vereisen actieve licentie,Bevestigd door Autel en dealers; SGW/Cloud-toegang expliciet abonnementsgebonden.,https://autel.us/software-subscriptions/
2,Autel MaxiSys Ultra | Update-licentie,https://astools.nl/products/autel-maxisys-ultra-update-licentie,extern,klopt,"Serienummer 12 karakters, achterzijde of Instellingen > Over",Conform Autel-registratiedocumentatie (dealerbron).,https://www.auteldiag.co.uk/blogs/autel-tech-solutions/how-to-register-autel-tools
2,Autel MaxiSys Ultra EV | Update-licentie,https://astools.nl/products/autel-maxisys-ultra-ev-update-licentie,intern,laag,SKU-veld bevat vrije tekst in plaats van een artikelnummer. Verder intern consistent.,,
2,Autel MaxiSys Ultra EV | Update-licentie,https://astools.nl/products/autel-maxisys-ultra-ev-update-licentie,extern,klopt,Er bestaat een eenjarige update-licentie (Total Care Program) voor de MaxiSys Ultra EV,Autel bevestigt; dealers verkopen de 'Ultra/Ultra EV One Year Update Service' los.,https://autel.us/software-subscriptions/
2,Autel MaxiSys Ultra EV | Update-licentie,https://astools.nl/products/autel-maxisys-ultra-ev-update-licentie,extern,klopt,Na verloop blijft het toestel functioneren op de laatste versie,Consistent met gedocumenteerd Autel-beleid.,https://www.obdprice.com/blogs/faqs/what-can-autel-scanners-do-after-the-subscription-expired
2,Autel MaxiSys Ultra EV | Update-licentie,https://astools.nl/products/autel-maxisys-ultra-ev-update-licentie,extern,klopt,Ultra EV biedt accupakketdiagnose met SoH/SoC-metingen,Autels productpagina bevestigt battery pack analysis incl. SoC/SoH.,https://store.autel.com/products/maxisys-ultra-ev
3,Autel MaxiCom Ultra Lite S | Update-licentie,https://astools.nl/products/autel-maxicom-ultra-lite-s-update-licentie,extern,klopt,Er bestaat een officiële 1-jaars update-licentie (Total Care Program) voor de Autel MaxiCom Ultra Lite S,Meerdere Autel-distributeurs verkopen de 'Ultra Lite S One Year Update Service' als los 1-jaars abonnement.,https://www.diagmart.com/products/autel-maxicom-ultra-lite-s-one-year-update-service
3,Autel MaxiCom Ultra Lite S | Update-licentie,https://astools.nl/products/autel-maxicom-ultra-lite-s-update-licentie,extern,klopt,Na afloop blijft het apparaat volledig functioneel met de laatste versie,Distributeur bevestigt letterlijk dat verlopen updates het normale gebruik niet beïnvloeden; standaard Autel-beleid.,https://www.diagmart.com/products/autel-maxicom-ultra-lite-s-one-year-update-service
3,Autel MaxiCom Ultra Lite S | Update-licentie,https://astools.nl/products/autel-maxicom-ultra-lite-s-update-licentie,extern,twijfel,Online functies die een actieve licentie vereisen zijn na afloop niet meer beschikbaar,Autel documenteert niet publiek welke online functies precies vervallen.,https://www.diagmart.com/products/autel-maxicom-ultra-lite-s-one-year-update-service
3,Autel MaxiCom Ultra Lite S | Update-licentie,https://astools.nl/products/autel-maxicom-ultra-lite-s-update-licentie,extern,niet_verifieerbaar,Het Autel-serienummer bestaat uit 12 karakters,"Vindplaatsen kloppen (sticker, Instellingen > Over), maar een vaste lengte van 12 karakters wordt nergens genoemd.",https://www.auteldiag.co.uk/blogs/autel-tech-solutions/how-to-register-autel-tools
3,Autel MaxiCom Ultra Lite S | Update-licentie,https://astools.nl/products/autel-maxicom-ultra-lite-s-update-licentie,extern,niet_verifieerbaar,Activatie binnen 24 uur na doorgeven serienummer,Winkelspecifiek proces; vergelijkbaar met distributeurs maar de 24-uursbelofte staat alleen op AsTools' pagina.,https://www.diagmart.com/products/autel-maxicom-ultra-lite-s-one-year-update-service
3,OBDSTAR MS70 | Uitleesapparaat | Motorfiets,https://astools.nl/products/obdstar-ms70-uitleesapparaat,intern,midden,"Onder 'Rapportage en data management' staat dat 'diagnoseresultaten en accutests' worden opgeslagen, terwijl nergens een accutest-functie voorkomt en OBDSTAR die voor de MS70 ook niet vermeldt. Boilerplate uit een ander productdossier.",,
3,OBDSTAR MS70 | Uitleesapparaat | Motorfiets,https://astools.nl/products/obdstar-ms70-uitleesapparaat,intern,laag,"'Interactieve schakelschema's' staat tweemaal in de tekst, o.a. onder 'Programmeer- en coderingfuncties' waar het niet thuishoort; 'Eerste foutbegeleiding' staat eveneens verkeerd ingedeeld.",,
3,OBDSTAR MS70 | Uitleesapparaat | Motorfiets,https://astools.nl/products/obdstar-ms70-uitleesapparaat,extern,klopt,"Android 5.1.1, RK3128 quad-core, 7 inch 1024×600, 3700mAh, Wi-Fi, -20°C tot 55°C",Exact conform de officiële OBDSTAR-pagina en distributeur OBDII365.,https://www.obdstar.com/Products_303.html
3,OBDSTAR MS70 | Uitleesapparaat | Motorfiets,https://astools.nl/products/obdstar-ms70-uitleesapparaat,extern,klopt_niet,Geheugen: 1 GB RAM / 32 GB ROM,OBDSTAR noemt 16 GB interne opslag; 32 GB is de maximale micro-SD-uitbreiding. RAM wordt door OBDSTAR niet gespecificeerd. Tweede bron OBDII365 bevestigt 16 GB.,https://www.obdstar.com/Products_303.html
3,OBDSTAR MS70 | Uitleesapparaat | Motorfiets,https://astools.nl/products/obdstar-ms70-uitleesapparaat,extern,klopt,"1 jaar gratis updates, daarna optionele jaarlijkse verlenging; apparaat blijft functioneel",OBDSTAR bevestigt; distributeur noemt ca. $180/jaar voor verlenging.,https://www.obdii365.com/wholesale/obdstar-ms70-motorcycle-diagnostic-scanner.html
3,OBDSTAR MS70 | Uitleesapparaat | Motorfiets,https://astools.nl/products/obdstar-ms70-uitleesapparaat,extern,klopt,"OE-niveau diagnose voor motorfietsen, waterscooters, ATV/UTV, sneeuwscooters; remote support; one-click update","Officiële pagina bevestigt doelvoertuigen (50+ merken), remote assistance en Wi-Fi-updates.",https://www.obdstar.com/Products_303.html
3,OBDSTAR MS70 | Uitleesapparaat | Motorfiets,https://astools.nl/products/obdstar-ms70-uitleesapparaat,extern,twijfel,Interactieve/dynamische schakelschema's,Noch OBDSTAR noch OBDII365 vermeldt schakelschema's als MS70-functie; alleen op AsTools' pagina te vinden.,
3,OBDSTAR MS70 | Uitleesapparaat | Motorfiets,https://astools.nl/products/obdstar-ms70-uitleesapparaat,extern,niet_verifieerbaar,"Verpakkingsinhoud: tablet, koffer, ca. 18 merkspecifieke OBD-verloopkabels","Distributeurs tonen een 'motor special kit' met adapterkabels, maar geen kabel-voor-kabel paklijst gevonden; leveromvang kan per configuratie verschillen.",https://www.obdii365.com/wholesale/obdstar-ms70-motorcycle-diagnostic-scanner.html
3,Autel MaxiSys MS909CV | Update-licentie,https://astools.nl/products/autel-maxisys-ms909cv-update-licentie,extern,klopt,Er bestaat een officiële 1-jaars update-licentie (Total Care Program) voor de MS909CV,"Bevestigd door twee onafhankelijke distributeurs (AESwave, DiagMart).",https://www.aeswave.com/Autel-MS909CV-Total-Care-Program-Subscription-for-1-yr-Autel-TCP-p10132.html
3,Autel MaxiSys MS909CV | Update-licentie,https://astools.nl/products/autel-maxisys-ms909cv-update-licentie,extern,klopt,"De MS909CV is gericht op bedrijfsvoertuigen, vrachtwagens en bussen",Conform Autel en distributeurs (heavy-duty/commercial vehicle).,https://store.autel.com/products/autel-maxisys-ms909cv
3,Autel MaxiSys MS909CV | Update-licentie,https://astools.nl/products/autel-maxisys-ms909cv-update-licentie,extern,klopt,Na verloop blijft het apparaat functioneren met de laatste versie,Distributeur bevestigt expliciet voor de MS909CV.,https://www.diagmart.com/products/autel-maxisys-ms909cv-one-year-update-service
3,Autel MaxiSys MS909CV | Update-licentie,https://astools.nl/products/autel-maxisys-ms909cv-update-licentie,extern,twijfel,Actieve licentie vereist voor online programmeren en technische ondersteuning,TCP omvat updates plus verlengde garantie; de koppeling van online programmeren en support aan de licentie is niet publiek gedocumenteerd.,https://www.aeswave.com/Autel-MS909CV-Total-Care-Program-Subscription-for-1-yr-Autel-TCP-p10132.html
3,Autel MaxiSys MS909CV | Update-licentie,https://astools.nl/products/autel-maxisys-ms909cv-update-licentie,extern,niet_verifieerbaar,Serienummer bestaat uit 12 karakters,Vindplaatsen kloppen; vaste lengte niet gedocumenteerd.,https://www.auteldiag.co.uk/blogs/autel-tech-solutions/how-to-register-autel-tools
3,Topdon Phoenix Smart | Update-licentie,https://astools.nl/products/topdon-phoenix-smart-update-licentie,intern,laag,"De variant-SKU's (1 jaar TD52110273, 2 jaar TD52110061) zijn identiek aan die van de Phoenix Max-licentiepagina, en TD52110273 wordt op AsTools' .eu-site ook voor Phoenix Elite- en Plus-licenties gebruikt. Vermoedelijk interne placeholder-SKU's, niet modelspecifiek verifieerbaar.",,
3,Topdon Phoenix Smart | Update-licentie,https://astools.nl/products/topdon-phoenix-smart-update-licentie,extern,klopt,Er bestaat een officiële update-licentie van 1 of 2 jaar voor de Phoenix Smart,"eu.topdon.com biedt One-Year- en Two-Year-opties (vanaf €749 excl. btw); AsTools' €899,95 incl. btw sluit daarbij aan.",https://eu.topdon.com/collections/software-updates
3,Topdon Phoenix Smart | Update-licentie,https://astools.nl/products/topdon-phoenix-smart-update-licentie,extern,klopt,"Zonder actieve licentie blijft bestaande software functioneel, maar vervallen nieuwe dekking en online functies",Conform Topdon's officiële Phoenix-FAQ.,https://service.topdon.com/portal/en/kb/articles/ph
3,Topdon Phoenix Smart | Update-licentie,https://astools.nl/products/topdon-phoenix-smart-update-licentie,extern,klopt,Phoenix Smart ondersteunt online programmering en codering,"Topdon vermeldt online programming/coding voor 13+ merken. Beperking geldt voor Noord-Amerika/Spanje/Portugal, niet voor de Nederlandse markt.",https://www.topdon.us/products/phoenix-smart
3,Topdon Phoenix Smart | Update-licentie,https://astools.nl/products/topdon-phoenix-smart-update-licentie,extern,twijfel,"Serienummer bestaat uit 12 karakters, van de tablet","Topdon zegt 12–14 karakters en vraagt het serienummer van de VCI/dongle, niet van de tablet. De instructie kan klanten het verkeerde nummer laten insturen.",https://www.topdon.us/products/phoenix-smart-max-passenger-car-update
3,Topdon Phoenix Smart | Update-licentie,https://astools.nl/products/topdon-phoenix-smart-update-licentie,extern,niet_verifieerbaar,"Verlengingscode binnen 24 uur via e-mail of WhatsApp, invoer via update-menu",Winkelspecifiek; Topdon verwerkt verlengingen op serienummer (tot 3 werkdagen) zonder code-invoer.,https://www.topdon.us/products/phoenix-smart-max-passenger-car-update
3,Topdon Phoenix Max | Update-licentie,https://astools.nl/products/topdon-phoenix-max-update-licentie,intern,laag,"Variant-SKU's identiek aan de Phoenix Smart-licentiepagina; TD52110273 wordt ook voor Elite/Plus gebruikt. Gedeelde SKU's kunnen kloppen (Topdon VS verkoopt Smart/Max als één updateproduct), maar zijn als modelspecifieke nummers niet verifieerbaar.",,
3,Topdon Phoenix Max | Update-licentie,https://astools.nl/products/topdon-phoenix-max-update-licentie,extern,klopt,Er bestaat een officiële update-licentie van 1 of 2 jaar voor de Phoenix Max,eu.topdon.com bevestigt beide opties (vanaf €749 excl. btw).,https://eu.topdon.com/products/phoenix-max-passenger-car-software-online-update
3,Topdon Phoenix Max | Update-licentie,https://astools.nl/products/topdon-phoenix-max-update-licentie,extern,klopt,"Na verloop blijft het toestel bruikbaar op de laatste versie, zonder updates en online functies",Exact conform Topdon's Phoenix-FAQ.,https://service.topdon.com/portal/en/kb/articles/ph
3,Topdon Phoenix Max | Update-licentie,https://astools.nl/products/topdon-phoenix-max-update-licentie,extern,klopt,Phoenix Max ondersteunt online programmeren en coderen (licentie vereist),Conform Topdon; regionale beperking geldt niet voor Nederland.,https://service.topdon.com/portal/en/kb/articles/ph
3,Topdon Phoenix Max | Update-licentie,https://astools.nl/products/topdon-phoenix-max-update-licentie,extern,twijfel,"Serienummer 12 karakters, van de tablet","Topdon: 12–14 karakters en het nummer van de VCI/dongle, niet de tablet.",https://www.topdon.us/products/phoenix-smart-max-passenger-car-update
3,Topdon Phoenix Max | Update-licentie,https://astools.nl/products/topdon-phoenix-max-update-licentie,extern,niet_verifieerbaar,Verlengingscode binnen 24 uur via e-mail/WhatsApp,"Winkelspecifiek proces, alleen op AsTools' pagina te vinden.",https://www.topdon.us/products/phoenix-smart-max-passenger-car-update
3,Autel MaxiCom MK906 Pro | Uitleesapparaat | Auto,https://astools.nl/products/autel-maxicom-mk906-pro-auto-uitleesapparaat,intern,hoog,"VCI-naam wisselt: lopende tekst en spec-tabel noemen de MaxiVCI V150, maar de verpakkingsinhoud vermeldt de V200. Officieel hoort de V200 bij de MK906 Pro; de V150 hoort bij de MaxiDAS DS900.",,
3,Autel MaxiCom MK906 Pro | Uitleesapparaat | Auto,https://astools.nl/products/autel-maxicom-mk906-pro-auto-uitleesapparaat,intern,hoog,"De spec-tabel bevat hardware van een ander (goedkoper) Autel-model, vrijwel zeker de MaxiDAS DS900: resolutie 1280x800, accu 7700 mAh en 8MP-camera zijn exact de DS900-specs. De echte MK906 Pro heeft 1920x1200, 11.600 mAh en 16MP-camera's. Ook 'ca. 925 gram' wijkt sterk af van de officiële 2,18 kg.",,
3,Autel MaxiCom MK906 Pro | Uitleesapparaat | Auto,https://astools.nl/products/autel-maxicom-mk906-pro-auto-uitleesapparaat,intern,midden,Licentieduur inconsistent: '1 jaar updates inbegrepen' gevolgd door 'Na het tweede jaar kan de licentie worden verlengd' — moet 'na het eerste jaar' zijn.,,
3,Autel MaxiCom MK906 Pro | Uitleesapparaat | Auto,https://astools.nl/products/autel-maxicom-mk906-pro-auto-uitleesapparaat,intern,laag,Processor '4x2.0 GHz + 4x1.8 GHz' wijkt licht af van de officiële Qualcomm 660-spec (4x2.2 + 4x1.8 GHz).,,
3,Autel MaxiCom MK906 Pro | Uitleesapparaat | Auto,https://astools.nl/products/autel-maxicom-mk906-pro-auto-uitleesapparaat,extern,klopt_niet,De MK906 Pro wordt geleverd met de MaxiVCI V150,Autel levert de MK906 Pro met de MaxiVCI V200; de V150 hoort bij de MaxiDAS DS900. De verpakkingsinhoud op de pagina noemt zelf wél correct de V200.,https://autel.com/mk3/3898.jhtml
3,Autel MaxiCom MK906 Pro | Uitleesapparaat | Auto,https://astools.nl/products/autel-maxicom-mk906-pro-auto-uitleesapparaat,extern,klopt_niet,Schermresolutie 1280 x 800,Officieel: 8-inch 1920x1200. 1280x800 is de DS900-resolutie.,https://autel.com/mk3/3898.jhtml
3,Autel MaxiCom MK906 Pro | Uitleesapparaat | Auto,https://astools.nl/products/autel-maxicom-mk906-pro-auto-uitleesapparaat,extern,klopt_niet,Accu 3.8V / 7700 mAh,Officieel: 11.600 mAh. 7700 mAh is de DS900-accu.,https://autel.com/mk3/3898.jhtml
3,Autel MaxiCom MK906 Pro | Uitleesapparaat | Auto,https://astools.nl/products/autel-maxicom-mk906-pro-auto-uitleesapparaat,extern,klopt_niet,Camera 8 Megapixel,Officieel: 16 MP achter- én frontcamera. 8 MP hoort bij de DS900.,https://autel.com/mk3/3898.jhtml
3,Autel MaxiCom MK906 Pro | Uitleesapparaat | Auto,https://astools.nl/products/autel-maxicom-mk906-pro-auto-uitleesapparaat,extern,klopt,1 jaar update-licentie inbegrepen,Autel's store en distributeurs bevestigen 'One Year Free Update'; de vervolgzin 'na het tweede jaar' op de pagina is intern fout.,https://store.autel.com/products/autel-mk906pro-obd2-diagnostic-scanner
3,Autel MaxiCom MK906 Pro | Uitleesapparaat | Auto,https://astools.nl/products/autel-maxicom-mk906-pro-auto-uitleesapparaat,extern,klopt,"Android 10, octa-core, 4GB/128GB, CAN FD en DoIP",Conform officiële specificaties; CAN FD/DoIP via de V200.,https://autel.com/mk3/3898.jhtml
3,Autel MaxiIM IM508S | Sleutelprogrammeur | Auto,https://astools.nl/products/autel-maxiim-im508s-auto-sleutelprogrammeur,intern,laag,Verpakkingsinhoud mist de USB Type-C-kabel die volgens de officiële Autel-packing list wordt meegeleverd; de rest van de lijst komt goed overeen.,,
3,Autel MaxiIM IM508S | Sleutelprogrammeur | Auto,https://astools.nl/products/autel-maxiim-im508s-auto-sleutelprogrammeur,intern,laag,'Vergelijkbaar met modellen uit de MaxiCheck-serie' (instapserie) botst met de claim 'OE-niveau diagnose op 80+ merken' elders op de pagina.,,
3,Autel MaxiIM IM508S | Sleutelprogrammeur | Auto,https://astools.nl/products/autel-maxiim-im508s-auto-sleutelprogrammeur,extern,twijfel,2 jaar gratis software-updates inbegrepen,"Bronnen spreken elkaar tegen: sommige dealers adverteren 2 jaar, meerdere andere 1 jaar; Autel zelf noemt geen periode. Regio-/bundelafhankelijk.",https://www.auteltool.us/products/autel-maxiim-im508s-key-programming-tool-2-years
3,Autel MaxiIM IM508S | Sleutelprogrammeur | Auto,https://astools.nl/products/autel-maxiim-im508s-auto-sleutelprogrammeur,extern,klopt,"Android 11, 1.8 GHz quad-core, 4GB/64GB, 7-inch 1024x600, 5000 mAh",Exact conform de officiële Autel-specificaties.,https://autel.us/product/maxiim-im508s/
3,Autel MaxiIM IM508S | Sleutelprogrammeur | Auto,https://astools.nl/products/autel-maxiim-im508s-auto-sleutelprogrammeur,extern,klopt,"Geleverd met XP200 + EEPROM-adapters + OBD1-adapters (Honda-3, Kia-10, Kia-20, Mazda-17)",De officiële packing list bevat al deze items; alleen de Type-C-kabel ontbreekt in de AsTools-lijst.,https://www.obdii365.com/wholesale/autel-im508s.html
3,Autel MaxiIM IM508S | Sleutelprogrammeur | Auto,https://astools.nl/products/autel-maxiim-im508s-auto-sleutelprogrammeur,extern,twijfel,Met XP400 Pro-upgrade praktisch het niveau van een IM608 Pro,"Deels waar, maar de IM608 Pro behoudt voordelen (J2534-programmering, hardware) die de IM508S+XP400 Pro niet krijgt. Enigszins overdreven marketing.",
3,Autel MaxiIM IM508S | Sleutelprogrammeur | Auto,https://astools.nl/products/autel-maxiim-im508s-auto-sleutelprogrammeur,extern,klopt,Volledige systeemdiagnose op 80+ merken,Conform Autel en dealers.,https://autel.us/product/maxiim-im508s/
3,Jaltest (29051) | CV | Update-licenties,https://astools.nl/products/jaltest-cv-update-licenties,intern,midden,Na verloop 'blijven de basale diagnosefuncties beschikbaar' — volgens Jaltest blijft bij de VOLLEDIGE CV-versie de complete diagnose op de laatste versie werken (niet slechts 'basaal'); alleen modulaire versies blokkeren. Het onderscheid volledig-vs-modulair ontbreekt.,,
3,Jaltest (29051) | CV | Update-licenties,https://astools.nl/products/jaltest-cv-update-licenties,intern,midden,"ETM-tegenstrijdigheid: de intro zegt dat ETM-toegang vervalt na verloop, de functielijst belooft 'Behoud van ETM en expertmodus'. Verwarrend; de vervallen-claim is extern niet bevestigd.",,
3,Jaltest (29051) | CV | Update-licenties,https://astools.nl/products/jaltest-cv-update-licenties,intern,laag,"'Uitsluitend bestemd voor de Jaltest V9 Link' is te strikt — de CV-licentie hoort bij de software, niet exclusief bij de V9-interface.",,
3,Jaltest (29051) | CV | Update-licenties,https://astools.nl/products/jaltest-cv-update-licenties,intern,laag,"Niet vermeld: Jaltest vereist elke ~6 maanden herregistratie, ook met verlopen licentie — relevant voor klantverwachting.",,
3,Jaltest (29051) | CV | Update-licenties,https://astools.nl/products/jaltest-cv-update-licenties,extern,twijfel,Artikelnummer 29051 = Jaltest CV update-licentie (1 jaar),29051 is vrijwel alleen op AsTools-pagina's vindbaar; de Amerikaanse Cojali-distributeur voert de CV-renewal onder COJ-29053. Onafhankelijke tweede bron ontbreekt.,https://mechnician.com/products/jaltest-renewal-commercial-vehicle-licence-of-use
3,Jaltest (29051) | CV | Update-licenties,https://astools.nl/products/jaltest-cv-update-licenties,extern,klopt,Looptijd één jaar,Jaltest CV-licenties lopen 365 dagen; renewal als 1-jaars abonnement met drie updates per jaar.,https://www.jaltest.com/en/faq/product-support/
3,Jaltest (29051) | CV | Update-licenties,https://astools.nl/products/jaltest-cv-update-licenties,extern,twijfel,Na verloop blijven basale diagnosefuncties beschikbaar; expertmodus blijft actief,Jaltest FAQ: bij de volledige versie blijft diagnose volledig werken; 'basaal' onderschat dit. Modulaire versies blokkeren wél — niet vermeld.,https://www.jaltest.com/en/faq/product-support/
3,Jaltest (29051) | CV | Update-licenties,https://astools.nl/products/jaltest-cv-update-licenties,extern,niet_verifieerbaar,Na verloop vervalt ETM-toegang,Geen fabrikantbron gevonden; alleen op de AsTools-pagina.,
3,Jaltest (29051) | CV | Update-licenties,https://astools.nl/products/jaltest-cv-update-licenties,extern,niet_verifieerbaar,Activatie binnen 24 uur; 9-karakters serienummer; registratie-eis bij AsTools,Distributeurspecifieke procesafspraken; andere distributeurs noemen 24-48 uur.,
3,Autel MaxiSys MS906CV | Update-licentie,https://astools.nl/products/autel-maxisys-ms906cv-update-licentie,intern,midden,"De tekst belooft dat na verloop 'online programmeermogelijkheden' vervallen — de MS906CV (Android 4.4.2, ca. 2016, bij Autel USA discontinued) heeft geen online ECU-programmeerfunctionaliteit. Generieke vultekst die niet bij dit model past.",,
3,Autel MaxiSys MS906CV | Update-licentie,https://astools.nl/products/autel-maxisys-ms906cv-update-licentie,intern,laag,"Nergens vermeld dat de MS906CV een verouderd/uitgefaseerd model is; voor een licentie van €1199,95 relevante context.",,
3,Autel MaxiSys MS906CV | Update-licentie,https://astools.nl/products/autel-maxisys-ms906cv-update-licentie,extern,klopt,De MS906CV is een diagnosetablet voor commerciële voertuigen,"Klopt (heavy-duty, Class 1-9); model staat bij Autel USA wel als discontinued.",https://autel.us/product/maxisys-ms906cv/
3,Autel MaxiSys MS906CV | Update-licentie,https://astools.nl/products/autel-maxisys-ms906cv-update-licentie,extern,klopt,Update-licentie looptijd één jaar,Conform Autel's jaarlijkse Total Care Program-model.,https://autel.us/product/maxisys-ms906cv/
3,Autel MaxiSys MS906CV | Update-licentie,https://astools.nl/products/autel-maxisys-ms906cv-update-licentie,extern,klopt,Na verloop blijft het toestel functioneren op de laatste versie,"Standaard Autel-beleid, breed bevestigd.",https://store.autel.com/products/autel-mk906pro-obd2-diagnostic-scanner
3,Autel MaxiSys MS906CV | Update-licentie,https://astools.nl/products/autel-maxisys-ms906cv-update-licentie,extern,klopt,Serienummer 12 karakters,Autel-serienummers zijn standaard 12-cijferig.,
3,Autel MaxiSys MS906CV | Update-licentie,https://astools.nl/products/autel-maxisys-ms906cv-update-licentie,extern,niet_verifieerbaar,"Prijs €1199,95 voor 1 jaar updates","Geen officiële EU-prijslijst gevonden. Opvallend: vier van de vijf producten in dit vijftal kosten exact €1199,95.",
3,OBDSTAR KeyMaster G3 | ECU Flasher | Software-licentie,https://astools.nl/products/obdstar-g3-ecu-flasher-software-licentie,intern,laag,Niet vermeld dat deze ECU Flasher-module (Module C) niet ondersteund wordt op de KeyMaster G3 USA-versie — gedocumenteerde beperking bij andere distributeurs.,,
3,OBDSTAR KeyMaster G3 | ECU Flasher | Software-licentie,https://astools.nl/products/obdstar-g3-ecu-flasher-software-licentie,intern,laag,De looptijd/het abonnementsmodel van deze licentie wordt nergens genoemd (eenmalig of jaarlijks?) — kan tot verkeerde verwachtingen leiden.,,
3,OBDSTAR KeyMaster G3 | ECU Flasher | Software-licentie,https://astools.nl/products/obdstar-g3-ecu-flasher-software-licentie,extern,klopt,De licentie activeert ECU-flasher-functionaliteit op de KeyMaster G3,"Bevestigd door meerdere distributeurs: 'Module C'-activatie voor Car ECM (1460+), TCM (320+), Body (160+) en Moto ECM — gelijkwaardig aan de DC706.",https://www.uhs-hardware.com/products/obdstar-key-master-g3-ecu-flasher-function
3,OBDSTAR KeyMaster G3 | ECU Flasher | Software-licentie,https://astools.nl/products/obdstar-g3-ecu-flasher-software-licentie,extern,klopt,"Ondersteunt BENCH, BOOT en OBD",Conform de compatibiliteitslijsten van de Module C-software.,https://www.locksmithkeyless.com/products/obdstar-key-master-g3-ecu-flasher-function-activation-software-module-c
3,OBDSTAR KeyMaster G3 | ECU Flasher | Software-licentie,https://astools.nl/products/obdstar-g3-ecu-flasher-software-licentie,extern,klopt,"Activatie automatisch, 24-48 uur, serienummer vereist",Conform andere distributeurs; digitale token gekoppeld aan één G3-apparaat.,https://www.uhs-hardware.com/products/obdstar-key-master-g3-ecu-flasher-function
3,OBDSTAR KeyMaster G3 | ECU Flasher | Software-licentie,https://astools.nl/products/obdstar-g3-ecu-flasher-software-licentie,extern,klopt,ECU-klonen zonder online programmeren,Kernfunctie; distributeurs beschrijven exact dit gebruik.,https://www.americankeysupply.com/product/keymaster-g3-software-activation-ecu-flasher-clone-obdstar-20848
3,OBDSTAR KeyMaster G3 | ECU Flasher | Software-licentie,https://astools.nl/products/obdstar-g3-ecu-flasher-software-licentie,extern,klopt,"Prijs €1159,95",Marktconform (UHS: $1.080-1.296).,https://www.uhs-hardware.com/products/obdstar-key-master-g3-ecu-flasher-function
3,Jaltest (70901007) | OEM RMI Iveco | Software-licentie,https://astools.nl/products/jaltest-70901007-oem-rmi-iveco-software-licentie,intern,hoog,De pagina claimt dat de RMI-licentie bruikbaar is 'zowel met een actieve als een verlopen Jaltest licentie'. Dit is precies het omgekeerde van de fabrikantsvoorwaarde: OEM RMI werkt uitsluitend met een geldige Jaltest CV/Truck-basislicentie. De verplichte basislicentie wordt nergens genoemd.,,
